{
  "schemaDialect": "http://json-schema.org/draft-07/schema#",
  "schemaPath": "docs/policies/provider-processing-policy.v4.schema.json",
  "documentType": "ai7-policy-document",
  "policyId": "provider-processing-policy",
  "policyType": "provider-processing",
  "version": "v4",
  "lifecycleStatus": "active",
  "predecessorVersion": "v3",
  "predecessorCanonicalPath": "docs/policies/provider-processing-policy.v3.json",
  "canonicalPath": "docs/policies/provider-processing-policy.v4.json",
  "humanProjectionPath": "docs/policies/provider-processing-policy.v4.md",
  "operationalScope": "developer-live",
  "authorityBasis": [
    "docs/domain/execution/CONTEXT.md",
    "docs/adr/0007-separate-decisions-authority-and-effect-proof.md",
    "docs/adr/0016-proprietary-license-and-local-only-sample-manuscripts.md",
    "docs/adr/0043-allow-public-samplebooks-in-repository-and-ci.md",
    "docs/adr/0046-separate-provider-processing-by-operational-scope.md",
    "docs/adr/0065-admit-a-developer-live-provider-processing-scope.md",
    "docs/adr/0067-authorize-the-opencode-go-development-credential-with-live-once-testing.md",
    "docs/architecture-v2/HARNESS-INTEGRATION.md"
  ],
  "trustedSelection": {
    "selectionAuthorityClass": "trusted-build-or-launch-authority",
    "launchArgument": "--trusted-operational-scope developer-live",
    "developerHostOnly": true,
    "hostedOrCiSelectionAllowed": false,
    "ordinaryProductSettingAllowed": false,
    "environmentVariableSelectorAllowed": false,
    "providerSelectorAllowed": false,
    "artifactOrPluginSelectorAllowed": false,
    "crossScopeFallbackAllowed": false,
    "selectionConfiguresProvider": false,
    "selectionDispatchesRun": false
  },
  "decision": {
    "default": "deny",
    "providerAllowRules": [
      {
        "ruleId": "developer-live-public-samplebook-analysis",
        "policyResult": "eligible-only",
        "purpose": "developer-live-prompt-and-pipeline-tuning",
        "authorityOrigin": {
          "newlyUserInitiatedTaskRequired": true,
          "directRunAuthorizationAllowed": true,
          "matchingActiveDefaultExecutionRuleAllowed": false,
          "backgroundAnalysisEnrollmentAllowed": false,
          "idleScheduledImportTriggeredOrCrossRunDispatchAllowed": false
        },
        "executionMode": {
          "humanAttended": true,
          "developerHostOnly": true,
          "ciAllowed": false,
          "hostedAllowed": false,
          "scheduledAllowed": false,
          "backgroundAllowed": false
        },
        "source": {
          "admittedInputs": "owner-designated-public-samplebooks-under-adr-0043",
          "transmittableSetFixedByImplementingSlice": true,
          "privateManuscriptAllowed": false,
          "otherBookRefusedBeforeDispatch": true
        },
        "allowedOutboundDataCategories": [
          "public-or-synthetic"
        ],
        "providerBinding": {
          "modelRole": "Main Editorial Role",
          "route": "opencode-go",
          "endpoint": "https://opencode.ai/zen/go/v1/chat/completions",
          "model": "deepseek-v4-flash",
          "credentialSlot": "opencode-go",
          "exactProviderBindingRequired": true,
          "fallbackAllowed": false,
          "approvedFallbackChainMaximumItems": 0,
          "secondModelAllowed": false,
          "productionDefaultsChanged": false
        },
        "transmissions": {
          "boundedByCoverageManifestUnitCount": true,
          "plusDeclaredSafeRetryAdaptations": true,
          "oneTechnicalSessionPerAnalysisUnit": true,
          "accumulatingSingleSessionAllowed": false,
          "identicalRequestReplaysFromProviderResultCache": true,
          "repeatedTestItemIdentifierAllowed": false
        },
        "authorizationPreconditions": {
          "eligibleConfiguredProviderRequired": true,
          "providerPreflightRequired": true,
          "exactProviderBindingRequired": true,
          "planEnvelopeRequired": true,
          "runAuthorizationRequired": true,
          "runSourceScopeRequired": true,
          "declaredOperationClassesRequired": true,
          "exactRunBudgetCeilingStateRequired": true,
          "unsetRunBudgetCeilingAllowed": false,
          "defaultRunBudgetCeilingTotalTokens": 500000,
          "ceilingEvaluatedBeforeEveryDispatch": true,
          "finalProviderPayloadEgressGateRequired": true,
          "frozenBeforeTransmission": true
        },
        "providerAccountLimit": {
          "classification": "quota-exhausted",
          "endsRunAsProviderAccountLimit": true,
          "retryAllowed": false,
          "fallbackAllowed": false,
          "secondModelAllowed": false
        },
        "capture": {
          "fixtureEmissionAllowed": false,
          "uploadAllowed": false,
          "providerResultCacheAllowed": true,
          "cacheLocation": "protected-local-staging-outside-every-checkout",
          "rawBytesInLogsDiagnosticsOrRepositoryAllowed": false,
          "repositoryEntryOnlyThroughReviewedFixtureGeneration": true
        },
        "additionalPrivacyPrompts": {
          "perBookRequired": false,
          "firstUseRequired": false,
          "perCallRequired": false,
          "perChunkRequired": false
        }
      }
    ]
  },
  "outboundDataCategories": {
    "public-or-synthetic": {
      "labelZh": "公开或合成内容"
    },
    "unpublished-metadata": {
      "labelZh": "未公开材料元数据"
    },
    "unpublished-excerpts": {
      "labelZh": "未公开材料选段"
    },
    "unpublished-full-content": {
      "labelZh": "未公开材料全文"
    }
  },
  "credentialBoundary": {
    "isOutboundDataCategory": false,
    "permittedInModelVisibleMaterial": false,
    "permittedInGeneralOutboundMaterial": false,
    "opaqueReferenceOnlyOutsideFinalConsumer": true,
    "credentialBrokerResolutionRequired": true,
    "finalAdapterOnly": true,
    "protectedSecretStoreOnly": true,
    "enrollmentHelperIsOnlyKeyFileReader": true,
    "policyEligibilityConfiguresCredential": false
  },
  "authoritySeparations": {
    "policyEligibilityDispatchesProviderCall": false,
    "policyEligibilityCreatesProviderImplementation": false,
    "runSourceScopeAloneAuthorizesTransmission": false,
    "runAuthorizationAloneOverridesThisPolicy": false,
    "configuredProviderAloneAuthorizesTransmission": false,
    "providerSetupAloneAuthorizesTransmission": false,
    "configuredCredentialAloneAuthorizesTransmission": false,
    "artifactInstallOrEnablementAuthorizesTransmission": false,
    "dshSessionOrPluginMembershipAuthorizesTransmission": false,
    "defaultExecutionRuleWithoutUserInitiatedTaskAuthorizesTransmission": false,
    "backgroundAnalysisEnrollmentAuthorizesTransmission": false,
    "externalExportPolicyAuthorizesProviderTransmission": false,
    "effectApprovalAuthorizesProviderTransmission": false,
    "providerResultCacheIsRecordedDeterministicModelFixture": false,
    "providerResultCacheProvesProviderConformance": false,
    "providerProcessingAuthorizesManuscriptApply": false,
    "providerProcessingAuthorizesLearning": false,
    "providerProcessingAuthorizesPublication": false,
    "providerProcessingGrantsPublicReleasePermission": false
  }
}
